station_id,name,location,state
464534092071501,"St. Louis Bay (T32A) Abv Blatnik Brg At Duluth, MN",St. Louis Bay (T32A) Abv Blatnik Brg At Duluth,MN
464534092071502,"St. Louis Bay (T32B) Abv Blatnik Brg At Duluth, MN",St. Louis Bay (T32B) Abv Blatnik Brg At Duluth,MN
464534092071601,"G6 St. Louis Bay Above Blatnik Bridge At Duluth, MN",G6 St. Louis Bay Above Blatnik Bridge At Duluth,MN
464535092070701,"St. Louis Bay (217A) Abv Blatnik Brg At Duluth, MN",St. Louis Bay (217A) Abv Blatnik Brg At Duluth,MN
464535092070702,"St. Louis Bay (217B) Abv Blatnik Brg At Duluth, MN",St. Louis Bay (217B) Abv Blatnik Brg At Duluth,MN
464537092065801,"G65 St. Louis Bay Above Blatnik Bridge At Duluth, MN",G65 St. Louis Bay Above Blatnik Bridge At Duluth,MN
464537092070101,"G55 St. Louis Bay Above Blatnik Bridge At Duluth, MN",G55 St. Louis Bay Above Blatnik Bridge At Duluth,MN
464537092070401,"G45 St. Louis Bay Above Blatnik Bridge At Duluth, MN",G45 St. Louis Bay Above Blatnik Bridge At Duluth,MN
464537092070701,"G34 St. Louis Bay Above Blatnik Bridge At Duluth, MN",G34 St. Louis Bay Above Blatnik Bridge At Duluth,MN
464537092071001,"G22 St. Louis Bay Above Blatnik Bridge At Duluth, MN",G22 St. Louis Bay Above Blatnik Bridge At Duluth,MN
464537092071301,"G12 St. Louis Bay Above Blatnik Bridge At Duluth, MN",G12 St. Louis Bay Above Blatnik Bridge At Duluth,MN
464537092071501,"St. Louis Bay (226A) Abv Blatnik Brg At Duluth, MN",St. Louis Bay (226A) Abv Blatnik Brg At Duluth,MN
464537092071502,"St. Louis Bay (226B) Abv Blatnik Brg At Duluth, MN",St. Louis Bay (226B) Abv Blatnik Brg At Duluth,MN
464537092071601,"G5 St. Louis Bay Above Blatnik Bridge At Duluth, MN",G5 St. Louis Bay Above Blatnik Bridge At Duluth,MN
464538092070601,"St. Louis Bay (T22A) Abv Blatnik Brg At Duluth, MN",St. Louis Bay (T22A) Abv Blatnik Brg At Duluth,MN
464538092070602,"St. Louis Bay (T22B) Abv Blatnik Brg At Duluth, MN",St. Louis Bay (T22B) Abv Blatnik Brg At Duluth,MN
464538092070603,"St. Louis Bay (T22C) Abv Blatnik Brg At Duluth, MN",St. Louis Bay (T22C) Abv Blatnik Brg At Duluth,MN
464538092070901,"St. Louis Bay (216A) Abv Blatnik Brg At Duluth, MN",St. Louis Bay (216A) Abv Blatnik Brg At Duluth,MN
464538092070902,"St. Louis Bay (216B) Abv Blatnik Brg At Duluth, MN",St. Louis Bay (216B) Abv Blatnik Brg At Duluth,MN
464538092070903,"St. Louis Bay (216C) Abv Blatnik Brg At Duluth, MN",St. Louis Bay (216C) Abv Blatnik Brg At Duluth,MN
464540092070101,"G54 St. Louis Bay Above Blatnik Bridge At Duluth, MN",G54 St. Louis Bay Above Blatnik Bridge At Duluth,MN
464540092070401,"G44 St. Louis Bay Above Blatnik Bridge At Duluth, MN",G44 St. Louis Bay Above Blatnik Bridge At Duluth,MN
464540092070701,"G33 St. Louis Bay Above Blatnik Bridge At Duluth, MN",G33 St. Louis Bay Above Blatnik Bridge At Duluth,MN
464540092071001,"G21 St. Louis Bay Above Blatnik Bridge At Duluth, MN",G21 St. Louis Bay Above Blatnik Bridge At Duluth,MN
464540092071301,"G11 St. Louis Bay Above Blatnik Bridge At Duluth, MN",G11 St. Louis Bay Above Blatnik Bridge At Duluth,MN
464542092070901,"St. Louis Bay (215A) Abv Blatnik Brg At Duluth, MN",St. Louis Bay (215A) Abv Blatnik Brg At Duluth,MN
464542092070902,"St. Louis Bay (215B) Abv Blatnik Brg At Duluth, MN",St. Louis Bay (215B) Abv Blatnik Brg At Duluth,MN
464543092070401,"G43 St. Louis Bay Above Blatnik Bridge At Duluth, MN",G43 St. Louis Bay Above Blatnik Bridge At Duluth,MN
464543092070701,"G32 St. Louis Bay Above Blatnik Bridge At Duluth, MN",G32 St. Louis Bay Above Blatnik Bridge At Duluth,MN
464543092071001,"G20 St. Louis Bay Above Blatnik Bridge At Duluth, MN",G20 St. Louis Bay Above Blatnik Bridge At Duluth,MN
464543092071301,"G10 St. Louis Bay Above Blatnik Bridge At Duluth, MN",G10 St. Louis Bay Above Blatnik Bridge At Duluth,MN
464543092071401,"St. Louis Bay (225) Abv Blatnik Brg At Duluth, MN",St. Louis Bay (225) Abv Blatnik Brg At Duluth,MN
464545092070601,"St. Louis Bay (214A) Abv Blatnik Brg At Duluth, MN",St. Louis Bay (214A) Abv Blatnik Brg At Duluth,MN
464545092070602,"St. Louis Bay (214B) Abv Blatnik Brg At Duluth, MN",St. Louis Bay (214B) Abv Blatnik Brg At Duluth,MN
464546092070701,"G31 St. Louis Bay Above Blatnik Bridge At Duluth, MN",G31 St. Louis Bay Above Blatnik Bridge At Duluth,MN
464546092071001,"G19 St. Louis Bay Above Blatnik Bridge At Duluth, MN",G19 St. Louis Bay Above Blatnik Bridge At Duluth,MN
464546092071301,"St. Louis Bay (T21A) Abv Blatnik Brg At Duluth, MN",St. Louis Bay (T21A) Abv Blatnik Brg At Duluth,MN
464546092071302,"St. Louis Bay (T21B) Abv Blatnik Brg At Duluth, MN",St. Louis Bay (T21B) Abv Blatnik Brg At Duluth,MN
464546092071303,"St. Louis Bay (T21C) Abv Blatnik Brg At Duluth, MN",St. Louis Bay (T21C) Abv Blatnik Brg At Duluth,MN
464546092071304,"G9 St. Louis Bay Above Blatnik Bridge At Duluth, MN",G9 St. Louis Bay Above Blatnik Bridge At Duluth,MN
464548092071001,"St. Louis Bay (224A) Abv Blatnik Brg At Duluth, MN",St. Louis Bay (224A) Abv Blatnik Brg At Duluth,MN
464548092071002,"St. Louis Bay (224B) Abv Blatnik Brg At Duluth, MN",St. Louis Bay (224B) Abv Blatnik Brg At Duluth,MN
464549092071001,"G18 St. Louis Bay Above Blatnik Bridge At Duluth, MN",G18 St. Louis Bay Above Blatnik Bridge At Duluth,MN
464549092071301,"G8 St. Louis Bay Above Blatnik Bridge At Duluth, MN",G8 St. Louis Bay Above Blatnik Bridge At Duluth,MN
464643092053701,"Superior Bay, MN",Superior Bay,MN
470620096203501,"S. Branch Wild Rice River At 220 St. Nr Ulen, MN",S. Branch Wild Rice River At 220 St. Nr Ulen,MN
471716096222801,"Wild Rice River At County Road 2 Nr Ulen, MN",Wild Rice River At County Road 2 Nr Ulen,MN
472533094284500,"Flus-04   146N30W34Bbb 01               0000243242, MN",Flus-04   146N30W34Bbb 01               0000243242,MN
473841096153101,"G15-R     148N44W10Cccc  01             0000620675, MN",G15-R     148N44W10Cccc  01             0000620675,MN
473945096202401,"E01D-R    148N45W01Cbdd  01             0000516287, MN",E01D-R    148N45W01Cbdd  01             0000516287,MN
473945096202402,"E01S-R    148N45W01Cbdd  01             0000249810, MN",E01S-R    148N45W01Cbdd  01             0000249810,MN
474125096120602,"G22S-R    149N43W29Ccbb  01             0000620682, MN",G22S-R    149N43W29Ccbb  01             0000620682,MN
474128096175501,"G13       149N44W28Cadd  01             0000620673, MN",G13       149N44W28Cadd  01             0000620673,MN
474129096145201,"E02D      149N44W26Dacd  01, MN",E02D      149N44W26Dacd  01,MN
474129096145202,"G09       149N44W26Ddca  01             0000620669, MN",G09       149N44W26Ddca  01             0000620669,MN
474135096203001,"G01-R     149N44W30Caad  01             0000620661, MN",G01-R     149N44W30Caad  01             0000620661,MN
474221096120901,"G16       149N43W19Dadd  01             0000620676, MN",G16       149N43W19Dadd  01             0000620676,MN
474236096171801,"Wl18W/S   149N44W21Adddac01 Areal Water & Sediment, MN",Wl18W/S   149N44W21Adddac01 Areal Water & Sediment,MN
474346096185501,"G08-R     149N44W17Abad  01             0000620668, MN",G08-R     149N44W17Abad  01             0000620668,MN
474403096191401,"Wl15-W/S1 149N44W08Cdaa  01 Restore Ne Water & Sed, MN",Wl15-W/S1 149N44W08Cdaa  01 Restore Ne Water & Sed,MN
474403096191402,"Wl15-W2   149N44W08Cdaa  02 Restore Nw Water, MN",Wl15-W2   149N44W08Cdaa  02 Restore Nw Water,MN
474403096191403,"Wl15-W3   149N44W08Cdaa  03 Restore Sw Water, MN",Wl15-W3   149N44W08Cdaa  03 Restore Sw Water,MN
474403096191404,"Wl15-W4   149N44W08Cdaa  04 Restore Se Water, MN",Wl15-W4   149N44W08Cdaa  04 Restore Se Water,MN
474426096192901,"Wl14-W/S1 149N44W08Bdbc  01 Control Ne Water & Sed, MN",Wl14-W/S1 149N44W08Bdbc  01 Control Ne Water & Sed,MN
474428096184901,"Wl17-W2   149N44W08Adbdcd01 Control S Water, MN",Wl17-W2   149N44W08Adbdcd01 Control S Water,MN
474434096184801,"Wl17-W3   149N44W08Aacdca01 Control Cs Water, MN",Wl17-W3   149N44W08Aacdca01 Control Cs Water,MN
474436096140801,"E03-R     149N44W12Bada  01             0000654754, MN",E03-R     149N44W12Bada  01             0000654754,MN
474440096185101,"Wl17-W/S1 149N44W08Aabcad01 Control Cn W. & E Sed., MN",Wl17-W/S1 149N44W08Aabcad01 Control Cn W. & E Sed.,MN
474443096185101,"Wl17-W4   149N44W08Aabbaa01 Control N Water, MN",Wl17-W4   149N44W08Aabbaa01 Control N Water,MN
474445096192201,"Wl16-W4   149N44W05Cddcdc01 Restore Sw Water, MN",Wl16-W4   149N44W05Cddcdc01 Restore Sw Water,MN
474448096192301,"Wl16-W3   149N44W05Cddbcc01 Restore E Water, MN",Wl16-W3   149N44W05Cddbcc01 Restore E Water,MN
474449096192701,"Wl16-W/S1149N44W05Cdcadb01 Restore W W. & E Sed., MN",Wl16-W/S1149N44W05Cdcadb01 Restore W W. & E Sed.,MN
474456096193701,"Wl16-W2   149N44W05Ccaaca01 Restore Nw Water, MN",Wl16-W2   149N44W05Ccaaca01 Restore Nw Water,MN
474708096261801,"L043      150N45W29Adaa  01 Gentilly, MN",L043      150N45W29Adaa  01 Gentilly,MN
475551091480501,"          063N12W24Aacacb01 Winton 3    0000181951, MN",          063N12W24Aacacb01 Winton 3    0000181951,MN
481633096031801,"Wb-A Agassiz Nwr- Farmes Pool, MN",Wb-A Agassiz Nwr- Farmes Pool,MN
482353096001901,"Wb-B Agassiz Nwr- Tamarack Pool, MN",Wb-B Agassiz Nwr- Tamarack Pool,MN
482918095564401,"Wb-C Thief Lake Wma- River Site, MN",Wb-C Thief Lake Wma- River Site,MN
485106094414301,"Lake Of The Woods, MN",Lake Of The Woods,MN
485519094434201,"Lk Of The Woods At Big Traverse Bay Nr Sable Is, MN",Lk Of The Woods At Big Traverse Bay Nr Sable Is,MN
485712096013001,"Wb-D Roseau River Wma - Dike Site, MN",Wb-D Roseau River Wma - Dike Site,MN
485713095111901,"Lake Of The Woods At Muskeg Bay Near Warrod, MN",Lake Of The Woods At Muskeg Bay Near Warrod,MN
490126094553301,"Lk Of The Woods At Big Traverse Bay Nr Long Pt., MN",Lk Of The Woods At Big Traverse Bay Nr Long Pt.,MN
491911094545101,"Lake Of The Woods, MN",Lake Of The Woods,MN
491958094523501,"Lk Of The Woods, MN",Lk Of The Woods,MN
02480212,"Pascagoula River At Mi 1 At Pascagoula, MS",Pascagoula River At Mi 1 At Pascagoula,MS
02480285,"West Pascagoula River At Hwy 90 At Gautier, MS",West Pascagoula River At Hwy 90 At Gautier,MS
02480287,"Graveline Bayou Near Gautier, MS",Graveline Bayou Near Gautier,MS
02480345,"Tchoutacabouffa River Trib Near White Plains, MS",Tchoutacabouffa River Trib Near White Plains,MS
02481251,"Turkey Creek At Airport Road At Gulfport, MS",Turkey Creek At Airport Road At Gulfport,MS
02481270,"Back Bay Of Biloxi Near Biloxi, MS",Back Bay Of Biloxi Near Biloxi,MS
02481549,"Hickory Creek Near Caesar, MS",Hickory Creek Near Caesar,MS
02481661,"Tributary To Bayou Lasalle Near Vidalia, MS",Tributary To Bayou Lasalle Near Vidalia,MS
02481663,"Rotten Bayou Nr Fenton, MS",Rotten Bayou Nr Fenton,MS
0248166310,"Mill Creek At Fenton, MS",Mill Creek At Fenton,MS
0248166590,"Rotten Bayou Trib No. 1 At Diamondhead, MS",Rotten Bayou Trib No. 1 At Diamondhead,MS
02481880,"Pearl River At Burnside, MS",Pearl River At Burnside,MS
02481960,"Wolf Creek At Industrial Drive Nr Pearl River, MS",Wolf Creek At Industrial Drive Nr Pearl River,MS
02481961,"Wolf Creek Near Pearl River, MS",Wolf Creek Near Pearl River,MS
02481970,"Jones Creek At Black Jack Road Nr Pearl River, MS",Jones Creek At Black Jack Road Nr Pearl River,MS
02481984,"Beasha Creek Near Coldwater, MS",Beasha Creek Near Coldwater,MS
02481998,"Beasha Creek Near Edinburg, MS",Beasha Creek Near Edinburg,MS
02482000,"Pearl River At Edinburg, MS",Pearl River At Edinburg,MS
02484760,"Fannegusha Creek Nr Sand Hill, MS",Fannegusha Creek Nr Sand Hill,MS
02492620,"Pearl River At Nstl Station, MS",Pearl River At Nstl Station,MS
07029297,"Eastes Creek Near Cornith, MS",Eastes Creek Near Cornith,MS
07029311,"Little Cane Creek Near Wenasoga, MS",Little Cane Creek Near Wenasoga,MS
0702931110,"Little Cane Creek At Cr 711 Near Wenasoga, MS",Little Cane Creek At Cr 711 Near Wenasoga,MS
07029313,"Tarebreeches Creek Near Theo, MS",Tarebreeches Creek Near Theo,MS
07029315,"Tarebreeches Creek Near Corinth, MS",Tarebreeches Creek Near Corinth,MS
0702941030,"North Prong Creek Near Falkner, MS",North Prong Creek Near Falkner,MS
0702941050,"North Prong Muddy Creek Trib 1 Near Falkner, MS",North Prong Muddy Creek Trib 1 Near Falkner,MS
07279300,"Coldwater River At Prichard, MS",Coldwater River At Prichard,MS
07279620,"Arkabutla Creek At Prichard, MS",Arkabutla Creek At Prichard,MS
07279680,"White Oak Bayou Near Little Texas, MS",White Oak Bayou Near Little Texas,MS
07279950,"Coldwater River At Marks, MS",Coldwater River At Marks,MS
07279970,"Bobo Bayou At Bobo, MS",Bobo Bayou At Bobo,MS
07280690,"Opossum Bayou At Brazil, MS",Opossum Bayou At Brazil,MS
07280695,"Muddy Bayou At Melton Road Near Stover, MS",Muddy Bayou At Melton Road Near Stover,MS
07280809,"Cassidy Bayou At Highway 322 Near Clarksdale, MS",Cassidy Bayou At Highway 322 Near Clarksdale,MS
07281600,"Tallahatchie River At Money, MS",Tallahatchie River At Money,MS
07286011,"Brushy Creek Near Macel, MS",Brushy Creek Near Macel,MS
07287700,"Phillips Bayou At Powell, MS",Phillips Bayou At Powell,MS
07288000,"Big Sunflower River At Clarksdale, MS",Big Sunflower River At Clarksdale,MS
07288048,"Richies Bayou At Sherard, MS",Richies Bayou At Sherard,MS
07288068,"Harris Bayou At Palmer Rd East Of Alligator, MS",Harris Bayou At Palmer Rd East Of Alligator,MS
07288070,"Harris Bayou Near Counts, MS",Harris Bayou Near Counts,MS
07288094,"Big Sunflower River At Johnson Rd Nr Roundaway, MS",Big Sunflower River At Johnson Rd Nr Roundaway,MS
07288136,"Hushpuckena River At Alligator, MS",Hushpuckena River At Alligator,MS
07288150,"Hushpuckena River At Hushpuckena, MS",Hushpuckena River At Hushpuckena,MS
07288185,"Black Bayou At Baltzer, MS",Black Bayou At Baltzer,MS
07288190,"Big Sunflower River Near Baltzer, MS",Big Sunflower River Near Baltzer,MS
07288361,"Dougherty Bayou Below Hwy 8 Near Ruleville, MS",Dougherty Bayou Below Hwy 8 Near Ruleville,MS
07288500,"Big Sunflower River At Sunflower, MS",Big Sunflower River At Sunflower,MS
07288519,"Porter Bayou At Hwy 448 At Frazier, MS",Porter Bayou At Hwy 448 At Frazier,MS
07288521,"Porter Bayou At Stephensville, MS",Porter Bayou At Stephensville,MS
07288550,"Quiver River Near Drew, MS",Quiver River Near Drew,MS
07288555,"Quiver River Southeast Ruleville, MS",Quiver River Southeast Ruleville,MS
07288580,"Quiver River Nr Sunflower, MS",Quiver River Nr Sunflower,MS
07288595,"Quiver River At Moorehead, MS",Quiver River At Moorehead,MS
07288621,"Big Sunflower River At Indianola, MS",Big Sunflower River At Indianola,MS
07288637,"Snake Creek Near Winstonville, MS",Snake Creek Near Winstonville,MS
0728864650,"Clear Creek Near Grapeland, MS",Clear Creek Near Grapeland,MS
07288650,"Bogue Phalia Nr Leland, MS",Bogue Phalia Nr Leland,MS
07288700,"Big Sunflower River Nr Anguilla, MS",Big Sunflower River Nr Anguilla,MS
07288711,"Rolling Fork Creek Near Rolling Fork, MS",Rolling Fork Creek Near Rolling Fork,MS
0728875070,"Deer Creek East Of Leland, MS",Deer Creek East Of Leland,MS
07288800,"Yazoo River At Redwood, MS",Yazoo River At Redwood,MS
07288842,"Granicus Bayou Nr Hollandale, MS",Granicus Bayou Nr Hollandale,MS
07288847,"Steele Bayou Nr Glen Allan, MS",Steele Bayou Nr Glen Allan,MS
07288860,"Steele Bayou At Grace Road At Hopedale, MS",Steele Bayou At Grace Road At Hopedale,MS
0728886910,"Steele Bayou Trib No 1 Near Grace, MS",Steele Bayou Trib No 1 Near Grace,MS
07288908,"Steele Bayou Below Onward, MS",Steele Bayou Below Onward,MS
07288955,"Yazoo River Bl Steele Bayou Nr Long Lake, MS",Yazoo River Bl Steele Bayou Nr Long Lake,MS
07294860,"Smith Creek Near Centreville, MS",Smith Creek Near Centreville,MS
07294870,"Buffalo River Near Wilkinson, MS",Buffalo River Near Wilkinson,MS
07294875,"Jackson Creek Near Centreville, MS",Jackson Creek Near Centreville,MS
07294890,"Browns Creek Near Woodville, MS",Browns Creek Near Woodville,MS
07294895,"Little Buffalo River Near Centreville, MS",Little Buffalo River Near Centreville,MS
07294927,"Dry Creek Nr Wilkinson, MS",Dry Creek Nr Wilkinson,MS
07294950,"Fords Creek Near Woodville, MS",Fords Creek Near Woodville,MS
07295000,"Buffalo River Nr Woodville, MS",Buffalo River Nr Woodville,MS
0737329750,"Dunbar Creek Near Woodville, MS",Dunbar Creek Near Woodville,MS
0737329760,"Beasley Creek Near Woodville, MS",Beasley Creek Near Woodville,MS
07373424,"Thompson Creek Near Newtonia, MS",Thompson Creek Near Newtonia,MS
07373426,"Thompson Creek Near Whitaker, MS",Thompson Creek Near Whitaker,MS
07373490,"West Fork Thompson Creek At Turnbull, MS",West Fork Thompson Creek At Turnbull,MS
07373552,"Carter Creek Near Woodville, MS",Carter Creek Near Woodville,MS
07375740,"Tickfaw River At Sr 568 Near Gillsburg, MS",Tickfaw River At Sr 568 Near Gillsburg,MS
07375750,"Tickfaw River At Gillsburg, MS",Tickfaw River At Gillsburg,MS
07376650,"East Fork Amite River At Highway 24 Nr Liberty, MS",East Fork Amite River At Highway 24 Nr Liberty,MS
07376673,"Hominy Creek Near Peoria, MS",Hominy Creek Near Peoria,MS
07376680,"East Fork Amite River Nr Peoria, MS",East Fork Amite River Nr Peoria,MS
07376685,"East Fork Amite River Nr Gillsburg, MS",East Fork Amite River Nr Gillsburg,MS
07376689,"West Fork Amite River Near Brookside, MS",West Fork Amite River Near Brookside,MS
07376762,"West Fork Amite River East Of Street, MS",West Fork Amite River East Of Street,MS
07376773,"Beaver Creek At Hwy 48 Near Centreville, MS",Beaver Creek At Hwy 48 Near Centreville,MS
07376775,"Beaver Creek Near Beechwood, MS",Beaver Creek Near Beechwood,MS
07377387,"Stafford Creek Near Centreville, MS",Stafford Creek Near Centreville,MS
301104089253400,"Mississippi Sound At Usgs St Joseph Island Light, MS",Mississippi Sound At Usgs St Joseph Island Light,MS
301141089320300,"East Pearl River At Csx Railroad Nr Claiborne, MS",East Pearl River At Csx Railroad Nr Claiborne,MS
301153088540200,"Gulf Of America 1 Mile South Of Ship Island, MS",Gulf Of America 1 Mile South Of Ship Island,MS
301208088253600,"Dwh Gom Oil Spill-Petit Bois Island Beach, MS",Dwh Gom Oil Spill-Petit Bois Island Beach,MS
301227088582000,"Dwh Gom Oil Spill-West Ship Island Beach, MS",Dwh Gom Oil Spill-West Ship Island Beach,MS
301258088295900,"Mississippi Sound North Of Petit Bois Island, MS",Mississippi Sound North Of Petit Bois Island,MS
301258089013000,"Mississippi Sound Between Cat And West Ship Island, MS",Mississippi Sound Between Cat And West Ship Island,MS
301309089044700,"Dwh Gom Oil Spill-South Cat Island Beach, MS",Dwh Gom Oil Spill-South Cat Island Beach,MS
301321088353300,"Dwh Gom Oil Spill-East Horn Island Beach, MS",Dwh Gom Oil Spill-East Horn Island Beach,MS
301322088564600,"Mississippi Sound North Of West Ship Island, MS",Mississippi Sound North Of West Ship Island,MS
301358088533300,"Dwh Gom Oil Spill-East Ship Island Beach, MS",Dwh Gom Oil Spill-East Ship Island Beach,MS
301424088395800,"Mississippi Sound North Of Horn Island, MS",Mississippi Sound North Of Horn Island,MS
301425088440600,"Dwh Gom Oil Spill-West Horn Island Beach, MS",Dwh Gom Oil Spill-West Horn Island Beach,MS
301429089145600,"Mississippi Sound At Usgs Merrill Shell Bank Light, MS",Mississippi Sound At Usgs Merrill Shell Bank Light,MS
301526089040000,"Mississippi Sound North Of Cat Island, MS",Mississippi Sound North Of Cat Island,MS
301527088521500,"Mississippi Sound At Usgs East Ship Island Light, MS",Mississippi Sound At Usgs East Ship Island Light,MS
301621088563800,"Mississippi Sound 4 Mi. North Of West Ship Island, MS",Mississippi Sound 4 Mi. North Of West Ship Island,MS
301650089215300,"Mississippi Sound At Waveland, MS",Mississippi Sound At Waveland,MS
301858089141000,"Dwh Gom Oil Spill-Pass Christian Beach, MS",Dwh Gom Oil Spill-Pass Christian Beach,MS
301912088583300,"Mississippi Sound At Usgs Gulfport Light, MS",Mississippi Sound At Usgs Gulfport Light,MS
301935089193300,"Noaa Tide Gage No. 8747437 At Bay St Louis, MS",Noaa Tide Gage No. 8747437 At Bay St Louis,MS
302036088320955,"Ms Sound At Country Club Dr At Pascagoula, MS",Ms Sound At Country Club Dr At Pascagoula,MS
302237089025855,"Ms Sound At Maywood Rd At Gulfport, MS",Ms Sound At Maywood Rd At Gulfport,MS
302318088512600,"Biloxi Bay At Point Cadet Harbor At Biloxi, MS",Biloxi Bay At Point Cadet Harbor At Biloxi,MS
302336088535800,"Dwh Gom Oil Spill-Biloxi Beach, MS",Dwh Gom Oil Spill-Biloxi Beach,MS
302421088495255,"Biloxi Bay At Jackson Ave At Ocean Springs, MS",Biloxi Bay At Jackson Ave At Ocean Springs,MS
305215089073600,"Flint Creek Reservoir At Wiggins, MS",Flint Creek Reservoir At Wiggins,MS
310506089291200,"Little Black Creek Reservoir Near Purvis, MS",Little Black Creek Reservoir Near Purvis,MS
310805089141600,"Geiger Lake Near Mclaurin, MS",Geiger Lake Near Mclaurin,MS
311845091272200,"Gillirad Lake Near Sibley, MS",Gillirad Lake Near Sibley,MS
312514091273400,"Butler Lake Near Sibley, MS",Butler Lake Near Sibley,MS
314416091213400,"Fields Lake Near Chruch Hill, MS",Fields Lake Near Chruch Hill,MS
322329090022500,"New Beach At Lakeshore Park, MS",New Beach At Lakeshore Park,MS
322331090013600,"Mouth At Pelahatchie Bay, MS",Mouth At Pelahatchie Bay,MS
323558090575400,"Steele Bayou Trib At Newman Rd Nr Valley Park, MS",Steele Bayou Trib At Newman Rd Nr Valley Park,MS
325458090571201,"Rice Field Prior To Risers, MS",Rice Field Prior To Risers,MS
325516090570701,"055A0174  Issaquena, MS",055A0174  Issaquena,MS
325637090434100,"Dowling Bayou Near Anguilla, MS",Dowling Bayou Near Anguilla,MS
325958090553500,"Otter Bayou Near Grace, MS",Otter Bayou Near Grace,MS
330203091020200,"Lake Washington Near Glen Allen, MS",Lake Washington Near Glen Allen,MS
330359090194135,"Bee Lake Nr Thornton                   072873355, MS",Bee Lake Nr Thornton                   072873355,MS
330735090300200,"Hard Cash Lake At Hard Cash, MS",Hard Cash Lake At Hard Cash,MS
331623091023700,"Lake Lee At Wayside, MS",Lake Lee At Wayside,MS
333136090244900,"Turkey Bayou Near Itta Bena, MS",Turkey Bayou Near Itta Bena,MS
333420090445900,"Porter Bayou Trib No 1 Nw Of Frazier, MS",Porter Bayou Trib No 1 Nw Of Frazier,MS
333601090450000,"Porter Bayou Near Shaw, MS",Porter Bayou Near Shaw,MS
333830090394600,"Porter Bayou Trib No 4 Off Fox Road Nr Shaw, MS",Porter Bayou Trib No 4 Off Fox Road Nr Shaw,MS
333957091034100,"Lake Whittington Near Bolivar, MS",Lake Whittington Near Bolivar,MS
334324090262400,"Dugan Bayou Near Ruleville Ms, MS",Dugan Bayou Near Ruleville Ms,MS
334747090285000,"Wild Bill Bayou Near Drew Ms, MS",Wild Bill Bayou Near Drew Ms,MS
335054090230200,"Parks Bayou Near Swan Lake, MS",Parks Bayou Near Swan Lake,MS
335408090224600,"Staten Brake At Hwy 32 Near Webb, MS",Staten Brake At Hwy 32 Near Webb,MS
335915090423900,"Hushpuckena River Nr Hushpuckena, MS",Hushpuckena River Nr Hushpuckena,MS
340036090474400,"Hushpuckena River At Desson, MS",Hushpuckena River At Desson,MS
340247088560200,"Davis Lake Near New Houlka, MS",Davis Lake Near New Houlka,MS
341341090413100,"Riches Bayou Nr Sherard Ms, MS",Riches Bayou Nr Sherard Ms,MS
341404090385600,"Overcup Slough Tributary No 1 Near Farrell, MS",Overcup Slough Tributary No 1 Near Farrell,MS
341436088534500,"Trace State Park Lake Near Pontotoc, MS",Trace State Park Lake Near Pontotoc,MS
341453090382800,"Overcup Slough Trib No 3 Nr Farrell, MS",Overcup Slough Trib No 3 Nr Farrell,MS
341526090392600,"Overcup Slough Trib No 4 Nr Farrell, MS",Overcup Slough Trib No 4 Nr Farrell,MS
341550090391300,"Overcup Slough Tributary No 2 Near Farrell, MS",Overcup Slough Tributary No 2 Near Farrell,MS
342328090273700,"Yazoo Pass At Rich Ms, MS",Yazoo Pass At Rich Ms,MS
343916088435600,"Lake Mohawk Near Booneville, MS",Lake Mohawk Near Booneville,MS
345021088561200,"North Prong Muddy Creek Below Hwy 15 At Falkner, MS",North Prong Muddy Creek Below Hwy 15 At Falkner,MS
345034088553800,"Muddy Creek At Falkner, MS",Muddy Creek At Falkner,MS
05495000,"Fox River At Wayland, MO",Fox River At Wayland,MO
05496000,"Wyaconda River Above Canton, MO",Wyaconda River Above Canton,MO
05500000,"South Fabius River Near Taylor, MO",South Fabius River Near Taylor,MO
06818000,"Missouri River At St. Joseph, MO",Missouri River At St. Joseph,MO
06819550,"Mozingo Creek Near Pickering, MO",Mozingo Creek Near Pickering,MO
06893000,"Missouri River At Kansas City, MO",Missouri River At Kansas City,MO
06893060,"Missouri River At Randolph, MO",Missouri River At Randolph,MO
06893150,"Blue River At Blue Ridge Blvd Ext In Kc, MO",Blue River At Blue Ridge Blvd Ext In Kc,MO
06893400,"Indian Creek At 103Rd St In Kansas City, MO",Indian Creek At 103Rd St In Kansas City,MO
06893500,"Blue River At Kansas City, MO",Blue River At Kansas City,MO
06893520,"Blue River Nr Gregory Blvd At Kansas City, MO",Blue River Nr Gregory Blvd At Kansas City,MO
06893530,"Blue River At 63Rd Street, MO",Blue River At 63Rd Street,MO
06893552,"Blue River @ Blue Parkway, MO",Blue River @ Blue Parkway,MO
06893557,"Brush Creek At Ward Parkway In Kansas City, MO",Brush Creek At Ward Parkway In Kansas City,MO
06893562,"Brush Creek At Rockhill Road In Kansas City, MO",Brush Creek At Rockhill Road In Kansas City,MO
06893563,"Town Fork Creek At Satchel Paige Mem Stad, MO",Town Fork Creek At Satchel Paige Mem Stad,MO
06893564,"Brush Creek At Elmwood Avenue In Kansas City, MO",Brush Creek At Elmwood Avenue In Kansas City,MO
06893578,"Blue River At Stadium Drive In Kansas City, MO",Blue River At Stadium Drive In Kansas City,MO
06893619,"Rock Creek At E Wilson Road In Independence, MO",Rock Creek At E Wilson Road In Independence,MO
06893620,"Rock Creek At Kentucky Road In Independence, MO",Rock Creek At Kentucky Road In Independence,MO
06893793,"Little Blue River Below Longview Dam At Kc, MO",Little Blue River Below Longview Dam At Kc,MO
06893820,"Little Blue R. At Lees Summit Rd In Independence, MO",Little Blue R. At Lees Summit Rd In Independence,MO
06893830,"Adair Creek At Independence, MO",Adair Creek At Independence,MO
06893890,"East Fork Little Blue River Near Blue Springs, MO",East Fork Little Blue River Near Blue Springs,MO
